query,canonical_query,source_sources,frequency_region,frequency_value,intent_initial,intent_confidence,cluster_candidate,include_status,exclude_reason,notes
разработка сайта на wordpress,разработка сайта на wordpress,разработка сайта на wordpress,225,137,commercial,high,c_wp_commercial,include,,canonicalTopicKey=wordpress разработка сайта
создание сайта на wordpress,создание сайта на wordpress,создание сайта на wordpress,225,470,commercial,high,c_wp_commercial,include,,canonicalTopicKey=wordpress разработка сайта
создание сайта на wordpress elementor,создание сайта на wordpress elementor,создание сайта на wordpress,225,75,commercial,high,c_wp_commercial,include,,canonicalTopicKey=wordpress разработка сайта
создания сайта на wordpress с нуля,создания сайта на wordpress с нуля,создание сайта на wordpress,225,73,commercial,high,c_wp_commercial,include,,canonicalTopicKey=создания сайта на wordpress
создание сайтов на основе wordpress,создание сайтов на основе wordpress,создание сайта на wordpress,225,41,commercial,medium,c_wp_commercial,include,,canonicalTopicKey=wordpress разработка сайта
создание сайта на теме wordpress,создание сайта на теме wordpress,создание сайта на wordpress,225,13,commercial,medium,c_wp_commercial,include,,canonicalTopicKey=wordpress разработка сайта
нейросеть для создания сайта на wordpress,нейросеть для создания сайта на wordpress,создание сайта на wordpress,225,12,commercial,medium,c_wp_commercial,include,,canonicalTopicKey=нейросеть для создания сайта
инструкция создания сайта на wordpress,инструкция создания сайта на wordpress,создание сайта на wordpress,225,12,commercial,medium,c_wp_commercial,include,,canonicalTopicKey=инструкция создания сайта на
создание сайта на wordpress пошаговая,создание сайта на wordpress пошаговая,создание сайта на wordpress,225,10,commercial,medium,c_wp_commercial,include,,canonicalTopicKey=wordpress разработка сайта
создание сайта на wordpress пошаговая инструкция,создание сайта на wordpress пошаговая инструкция,создание сайта на wordpress,225,10,commercial,medium,c_wp_commercial,include,,canonicalTopicKey=wordpress разработка сайта
создание сайтов на wordpress цена,создание сайтов на wordpress цена,создание сайта на wordpress,225,7,commercial,medium,c_wp_commercial,include,,canonicalTopicKey=wordpress разработка сайта
создание и продвижение сайтов на wordpress,создание и продвижение сайтов на wordpress,создание сайта на wordpress,225,5,commercial,medium,c_wp_commercial,include,,canonicalTopicKey=wordpress разработка сайта
заказать сайт на wordpress,заказать сайт на wordpress,заказать сайт на wordpress,225,54,commercial,high,c_wp_commercial,include,,canonicalTopicKey=wordpress заказать сайт
сайт под ключ,сайт под ключ,заказать сайт на wordpress,225,5192,commercial,high,c_wp_commercial,include,,canonicalTopicKey=сайт под ключ
сколько стоит сделать сайт,сколько стоит сделать сайт,заказать сайт на wordpress,225,1373,commercial,high,c_wp_commercial,include,,canonicalTopicKey=сколько стоит сделать сайт
сколько стоит создать сайт,сколько стоит создать сайт,заказать сайт на wordpress,225,941,commercial,high,c_wp_commercial,include,,canonicalTopicKey=сколько стоит создать сайт
вордпресс создание сайта,вордпресс создание сайта,заказать сайт на wordpress,225,468,commercial,high,c_wp_commercial,include,,canonicalTopicKey=вордпресс создание сайта
seo продвижение сайта,seo продвижение сайта,seo продвижение сайта,225,8513,commercial,high,c_seo_wp,include,,canonicalTopicKey=seo продвижение сайта
seo продвижение сайта москва,seo продвижение сайта москва,seo продвижение сайта,225,874,commercial,high,c_seo_wp,include,,canonicalTopicKey=seo продвижение сайта москва
seo продвижение сайта заказать,seo продвижение сайта заказать,seo продвижение сайта,225,667,commercial,high,c_seo_wp,include,,canonicalTopicKey=seo продвижение сайта заказать
seo оптимизация продвижение сайтов,seo оптимизация продвижение сайтов,seo продвижение сайта,225,636,commercial,high,c_seo_wp,include,,canonicalTopicKey=seo оптимизация продвижение сайтов
поисковое продвижение сайта seo,поисковое продвижение сайта seo,seo продвижение сайта,225,616,commercial,high,c_seo_wp,include,,canonicalTopicKey=поисковое продвижение сайта seo
seo продвижение сайтов цена,seo продвижение сайтов цена,seo продвижение сайта,225,487,commercial,high,c_seo_wp,include,,canonicalTopicKey=seo продвижение сайтов цена
сео продвижение сайтов seo,сео продвижение сайтов seo,seo продвижение сайта,225,287,commercial,high,c_seo_wp,include,,canonicalTopicKey=сео продвижение сайтов seo
seo система продвижение сайтов,seo система продвижение сайтов,seo продвижение сайта,225,284,commercial,high,c_seo_wp,include,,canonicalTopicKey=seo система продвижение сайтов
seo продвижение раскрутка сайта,seo продвижение раскрутка сайта,seo продвижение сайта,225,279,commercial,high,c_seo_wp,include,,canonicalTopicKey=seo продвижение раскрутка сайта
seo ru продвижение сайтов,seo ru продвижение сайтов,seo продвижение сайта,225,238,commercial,high,c_seo_wp,include,,canonicalTopicKey=seo ru продвижение сайтов
seo продвижение сайта россия,seo продвижение сайта россия,seo продвижение сайта,225,234,commercial,high,c_seo_wp,include,,canonicalTopicKey=seo продвижение сайта россия
seo продвижение сайта услуги,seo продвижение сайта услуги,seo продвижение сайта,225,229,commercial,high,c_seo_wp,include,,canonicalTopicKey=seo продвижение сайта услуги
seo продвижение сайта в яндекс,seo продвижение сайта в яндекс,seo продвижение сайта,225,220,commercial,high,c_seo_wp,include,,canonicalTopicKey=seo продвижение сайта в
продвижение сайта в яндексе,продвижение сайта в яндексе,продвижение сайта в яндексе,225,1950,commercial,high,c_yandex_seo,include,,canonicalTopicKey=продвижение сайта в яндексе
продвижение сайта в топ яндекса,продвижение сайта в топ яндекса,продвижение сайта в яндексе,225,423,commercial,high,c_yandex_seo,include,,canonicalTopicKey=продвижение сайта в топ
продвижение сайтов в яндексе москва,продвижение сайтов в яндексе москва,продвижение сайта в яндексе,225,300,commercial,high,c_yandex_seo,include,,canonicalTopicKey=продвижение сайтов в яндексе
seo продвижение сайта в яндекс,seo продвижение сайта в яндекс,продвижение сайта в яндексе,225,220,commercial,high,c_yandex_seo,include,,canonicalTopicKey=seo продвижение сайта в
продвижение сайтов в 10 яндекс,продвижение сайтов в 10 яндекс,продвижение сайта в яндексе,225,191,commercial,high,c_yandex_seo,include,,canonicalTopicKey=продвижение сайтов в 10
продвижение сайта в яндекс директ,продвижение сайта в яндекс директ,продвижение сайта в яндексе,225,189,commercial,high,c_yandex_seo,include,,canonicalTopicKey=продвижение сайта в яндекс
продвижение сайта в яндексе цена,продвижение сайта в яндексе цена,продвижение сайта в яндексе,225,166,commercial,high,c_yandex_seo,include,,canonicalTopicKey=продвижение сайта в яндексе
продвижение сайта в топ 10 яндекса,продвижение сайта в топ 10 яндекса,продвижение сайта в яндексе,225,150,commercial,high,c_yandex_seo,include,,canonicalTopicKey=продвижение сайта в топ
поисковое продвижение сайта в яндекс,поисковое продвижение сайта в яндекс,продвижение сайта в яндексе,225,91,commercial,high,c_yandex_seo,include,,canonicalTopicKey=поисковое продвижение сайта в
продвижение сайта в системе яндекс,продвижение сайта в системе яндекс,продвижение сайта в яндексе,225,55,commercial,high,c_yandex_seo,include,,canonicalTopicKey=продвижение сайта в системе
продвижение сайта в поисковой системе яндекс,продвижение сайта в поисковой системе яндекс,продвижение сайта в яндексе,225,54,commercial,high,c_yandex_seo,include,,canonicalTopicKey=продвижение сайта в поисковой
заказать продвижение сайта в яндекс,заказать продвижение сайта в яндекс,продвижение сайта в яндексе,225,53,commercial,high,c_yandex_seo,include,,canonicalTopicKey=заказать продвижение сайта в
сео продвижение сайта в яндекс,сео продвижение сайта в яндекс,продвижение сайта в яндексе,225,50,commercial,high,c_yandex_seo,include,,canonicalTopicKey=сео продвижение сайта в
seo аудит сайта,seo аудит сайта,seo аудит сайта,225,506,commercial,high,c_seo_audit,include,,canonicalTopicKey=seo аудит сайта
бесплатный seo аудит сайта,бесплатный seo аудит сайта,seo аудит сайта,225,262,commercial,high,c_seo_audit,include,,canonicalTopicKey=бесплатный seo аудит сайта
seo анализ сайта аудит,seo анализ сайта аудит,seo аудит сайта,225,252,commercial,high,c_seo_audit,include,,canonicalTopicKey=seo анализ сайта аудит
seo аудит сайта технического seo аудита,seo аудит сайта технического seo аудита,seo аудит сайта,225,54,commercial,high,c_seo_audit,include,,canonicalTopicKey=seo аудит сайта технического
seo аудит сайта онлайн,seo аудит сайта онлайн,seo аудит сайта,225,33,commercial,medium,c_seo_audit,include,,canonicalTopicKey=seo аудит сайта онлайн
провести seo аудит сайта,провести seo аудит сайта,seo аудит сайта,225,19,commercial,medium,c_seo_audit,include,,canonicalTopicKey=провести seo аудит сайта
seo аудит сайта онлайн бесплатно,seo аудит сайта онлайн бесплатно,seo аудит сайта,225,11,commercial,medium,c_seo_audit,include,,canonicalTopicKey=seo аудит сайта онлайн
аудит seo продвижение сайта,аудит seo продвижение сайта,seo аудит сайта,225,8,commercial,medium,c_seo_audit,include,,canonicalTopicKey=аудит seo продвижение сайта
технический аудит сайта на своем сервере seo,технический аудит сайта на своем сервере seo,seo аудит сайта,225,7,commercial,medium,c_seo_audit,include,,canonicalTopicKey=технический аудит сайта на
настройка wordpress,настройка wordpress,настройка wordpress,225,658,mixed,high,c_wp_setup,include,,canonicalTopicKey=настройка wordpress
настройка сайта wordpress,настройка сайта wordpress,настройка wordpress,225,116,mixed,high,c_wp_setup,include,,canonicalTopicKey=настройка сайта wordpress
настройки темы wordpress,настройки темы wordpress,настройка wordpress,225,59,mixed,high,c_wp_setup,include,,canonicalTopicKey=настройки темы wordpress
настройки плагинов wordpress,настройки плагинов wordpress,настройка wordpress,225,57,mixed,high,c_wp_setup,include,,canonicalTopicKey=настройки плагинов wordpress
страница настроек wordpress,страница настроек wordpress,настройка wordpress,225,49,mixed,medium,c_wp_setup,include,,canonicalTopicKey=страница настроек wordpress
wordpress установка настройка,wordpress установка настройка,настройка wordpress,225,48,mixed,medium,c_wp_setup,include,,canonicalTopicKey=wordpress установка настройка
wordpress настройка сервера,wordpress настройка сервера,настройка wordpress,225,30,mixed,medium,c_wp_setup,include,,canonicalTopicKey=wordpress настройка сервера
настройка seo wordpress,настройка seo wordpress,настройка wordpress,225,26,mixed,medium,c_wp_setup,include,,canonicalTopicKey=настройка seo wordpress
smtp wordpress настройки,smtp wordpress настройки,настройка wordpress,225,25,mixed,medium,c_wp_setup,include,,canonicalTopicKey=smtp wordpress настройки
wordpress настройки базы,wordpress настройки базы,настройка wordpress,225,22,mixed,medium,c_wp_setup,include,,canonicalTopicKey=wordpress настройки базы
настройка woocommerce wordpress,настройка woocommerce wordpress,настройка wordpress,225,22,mixed,medium,c_wp_setup,include,,canonicalTopicKey=настройка woocommerce wordpress
wp mail smtp wordpress настройка,wp mail smtp wordpress настройка,настройка wordpress,225,21,mixed,medium,c_wp_setup,include,,canonicalTopicKey=wp mail smtp wordpress
настройка wordpress для новичков,настройка wordpress для новичков,настройка wordpress,225,20,mixed,medium,c_wp_setup,include,,canonicalTopicKey=настройка wordpress для новичков
wordpress настройка php,wordpress настройка php,настройка wordpress,225,17,mixed,medium,c_wp_setup,include,,canonicalTopicKey=wordpress настройка php
htaccess wordpress настройка,htaccess wordpress настройка,настройка wordpress,225,14,mixed,medium,c_wp_setup,include,,canonicalTopicKey=htaccess wordpress настройка
wordpress почта настройка,wordpress почта настройка,настройка wordpress,225,13,mixed,medium,c_wp_setup,include,,canonicalTopicKey=wordpress почта настройка
ускорение сайта на wordpress,ускорение сайта на wordpress,ускорение сайта wordpress,225,31,mixed,medium,c_wp_performance,include,,canonicalTopicKey=ускорение сайта на wordpress
плагин для ускорения сайта на wordpress,плагин для ускорения сайта на wordpress,ускорение сайта wordpress,225,10,mixed,medium,c_wp_performance,include,,canonicalTopicKey=плагин для ускорения сайта
перенос сайта на wordpress,перенос сайта на wordpress,перенос сайта wordpress,225,101,mixed,high,c_wp_migration,include,,canonicalTopicKey=перенос сайта на wordpress
перенос сайта wordpress на другой,перенос сайта wordpress на другой,перенос сайта wordpress,225,46,mixed,medium,c_wp_migration,include,,canonicalTopicKey=перенос сайта wordpress на
перенос сайта wordpress на хостинг,перенос сайта wordpress на хостинг,перенос сайта wordpress,225,28,mixed,medium,c_wp_migration,include,,canonicalTopicKey=перенос сайта wordpress на
перенос сайта на wordpress на домен,перенос сайта на wordpress на домен,перенос сайта wordpress,225,25,mixed,medium,c_wp_migration,include,,canonicalTopicKey=перенос сайта на wordpress
перенос сайт wordpress на другой домен,перенос сайт wordpress на другой домен,перенос сайта wordpress,225,22,mixed,medium,c_wp_migration,include,,canonicalTopicKey=перенос сайт wordpress на
wordpress перенос сайта на другой хостинг,wordpress перенос сайта на другой хостинг,перенос сайта wordpress,225,20,mixed,medium,c_wp_migration,include,,canonicalTopicKey=wordpress перенос сайта на
доработка сайта на wordpress,доработка сайта на wordpress,доработка сайта wordpress,225,45,commercial,medium,c_wp_support,include,,canonicalTopicKey=доработка сайта на wordpress
поддержка сайтов wordpress,поддержка сайтов wordpress,поддержка сайта wordpress,225,48,commercial,medium,c_wp_support,include,,canonicalTopicKey=поддержка сайтов wordpress
техническая поддержка сайта wordpress,техническая поддержка сайта wordpress,поддержка сайта wordpress,225,8,commercial,medium,c_wp_support,include,,canonicalTopicKey=техническая поддержка сайта wordpress
безопасность wordpress,безопасность wordpress,безопасность wordpress,225,84,commercial,high,c_wp_security,include,,canonicalTopicKey=wordpress безопасность
безопасность сайта wordpress,безопасность сайта wordpress,безопасность wordpress,225,21,commercial,medium,c_wp_security,include,,canonicalTopicKey=wordpress безопасность
безопасность wordpress плагины,безопасность wordpress плагины,безопасность wordpress,225,13,commercial,medium,c_wp_security,include,,canonicalTopicKey=wordpress безопасность
wordpress книга по безопасности,wordpress книга по безопасности,безопасность wordpress,225,6,commercial,medium,c_wp_security,include,,canonicalTopicKey=wordpress книга по безопасности
wordpress вирусы,wordpress вирусы,wordpress вирусы,225,30,commercial,medium,c_wp_security,include,,canonicalTopicKey=wordpress безопасность
калькулятор для сайта,калькулятор для сайта,калькулятор для сайта,225,1908,commercial,high,c_calculators,include,,canonicalTopicKey=калькулятор для сайта
онлайн калькулятор для сайта,онлайн калькулятор для сайта,калькулятор для сайта,225,614,commercial,high,c_calculators,include,,canonicalTopicKey=онлайн калькулятор для сайта
калькулятор для расчета сайта,калькулятор для расчета сайта,калькулятор для сайта,225,541,commercial,high,c_calculators,include,,canonicalTopicKey=калькулятор для расчета сайта
калькулятор стоимости для сайта,калькулятор стоимости для сайта,калькулятор для сайта,225,525,commercial,high,c_calculators,include,,canonicalTopicKey=калькулятор стоимости для сайта
калькуляторы для сайта бесплатно,калькуляторы для сайта бесплатно,калькулятор для сайта,225,92,commercial,high,c_calculators,include,,canonicalTopicKey=калькуляторы для сайта бесплатно
калькулятор для сайта скачать,калькулятор для сайта скачать,калькулятор для сайта,225,57,commercial,high,c_calculators,include,,canonicalTopicKey=калькулятор для сайта скачать
разработка калькулятора для сайта,разработка калькулятора для сайта,калькулятор для сайта,225,45,commercial,medium,c_calculators,include,,canonicalTopicKey=разработка калькулятора для сайта
создать калькулятор для сайта,создать калькулятор для сайта,калькулятор для сайта,225,44,commercial,medium,c_calculators,include,,canonicalTopicKey=создать калькулятор для сайта
калькулятор для расчета стоимости сайта,калькулятор для расчета стоимости сайта,калькулятор для сайта,225,29,commercial,medium,c_calculators,include,,canonicalTopicKey=калькулятор для расчета стоимости
создание калькуляторов для сайта,создание калькуляторов для сайта,калькулятор для сайта,225,27,commercial,medium,c_calculators,include,,canonicalTopicKey=создание калькуляторов для сайта
код калькулятора для сайта,код калькулятора для сайта,калькулятор для сайта,225,26,commercial,medium,c_calculators,include,,canonicalTopicKey=код калькулятора для сайта
конструктор калькуляторов для сайтов,конструктор калькуляторов для сайтов,калькулятор для сайта,225,25,commercial,medium,c_calculators,include,,canonicalTopicKey=конструктор калькуляторов для сайтов
как сделать калькулятор для сайта,как сделать калькулятор для сайта,калькулятор для сайта,225,23,commercial,medium,c_calculators,include,,canonicalTopicKey=как сделать калькулятор для
калькулятор доставки для сайта,калькулятор доставки для сайта,калькулятор для сайта,225,22,commercial,medium,c_calculators,include,,canonicalTopicKey=калькулятор доставки для сайта
калькулятор услуг для сайта,калькулятор услуг для сайта,калькулятор для сайта,225,21,commercial,medium,c_calculators,include,,canonicalTopicKey=калькулятор услуг для сайта
wordpress плагины разработка,wordpress плагины разработка,разработка плагина wordpress,225,26,mixed,medium,c_plugins_themes,include,,canonicalTopicKey=wordpress разработка сайта
нейросеть для создания сайтов,нейросеть для создания сайтов,нейросеть для создания сайта,225,3139,mixed,high,c_geo_ai,include,,canonicalTopicKey=нейросеть для создания сайтов
нейросеть для создания сайта бесплатно,нейросеть для создания сайта бесплатно,нейросеть для создания сайта,225,865,mixed,high,c_geo_ai,include,,canonicalTopicKey=нейросеть для создания сайта
