query,canonical_query,source_sources,frequency_region,frequency_value,intent_initial,intent_confidence,cluster_candidate,include_status,exclude_reason,notes
лучшая нейросеть для создания сайтов,лучшая нейросеть для создания сайтов,нейросеть для создания сайта,225,133,mixed,high,c_geo_ai,include,,canonicalTopicKey=лучшая нейросеть для создания
нейросеть для создания сайта на русском,нейросеть для создания сайта на русском,нейросеть для создания сайта,225,92,mixed,high,c_geo_ai,include,,canonicalTopicKey=нейросеть для создания сайта
нейросеть для создания дизайна сайта,нейросеть для создания дизайна сайта,нейросеть для создания сайта,225,90,mixed,high,c_geo_ai,include,,canonicalTopicKey=нейросеть для создания дизайна
ai нейросеть для создания сайта,ai нейросеть для создания сайта,нейросеть для создания сайта,225,85,mixed,high,c_geo_ai,include,,canonicalTopicKey=ai нейросеть для создания
нейросеть для создания сайта с нуля,нейросеть для создания сайта с нуля,нейросеть для создания сайта,225,78,mixed,high,c_geo_ai,include,,canonicalTopicKey=нейросеть для создания сайта
нейросеть для создания сайтов с нуля бесплатно,нейросеть для создания сайтов с нуля бесплатно,нейросеть для создания сайта,225,67,mixed,high,c_geo_ai,include,,canonicalTopicKey=нейросеть для создания сайтов
нейросеть для создания сайта онлайн,нейросеть для создания сайта онлайн,нейросеть для создания сайта,225,52,mixed,high,c_geo_ai,include,,canonicalTopicKey=нейросеть для создания сайта
оптимизация сайта под нейросети,оптимизация сайта под нейросети,оптимизация сайта под нейросети,225,31,mixed,medium,c_geo_ai,include,,canonicalTopicKey=оптимизация сайта под нейросети
наполнение сайта контентом,наполнение сайта контентом,наполнение сайта контентом,225,293,commercial,high,c_content,include,,canonicalTopicKey=наполнение сайта контентом
наполнение сайта контентом работа,наполнение сайта контентом работа,наполнение сайта контентом,225,33,commercial,medium,c_content,include,,canonicalTopicKey=наполнение сайта контентом работа
контент менеджер наполнение сайта,контент менеджер наполнение сайта,наполнение сайта контентом,225,13,commercial,medium,c_content,include,,canonicalTopicKey=контент менеджер наполнение сайта
пошаговое наполнение сайта контентом,пошаговое наполнение сайта контентом,наполнение сайта контентом,225,6,commercial,medium,c_content,include,,canonicalTopicKey=пошаговое наполнение сайта контентом
заказать статью для сайта,заказать статью для сайта,статья для сайта заказать,225,26,commercial,medium,c_content,include,,canonicalTopicKey=заказать статью для сайта
